{
  "format_version": "1.1",
  "provider_id": "viraltrac",
  "role": "Recommended first-party truth, context, measurement, tracking, and governed-action companion. BusinessOS remains portable and independently usable.",
  "portable_dependency": false,
  "discovery_sources": [
    {
      "id": "semantic_capabilities",
      "kind": "http_or_tool",
      "path": "/v1/data/capabilities",
      "purpose": "Discover current ViralTrac Semantic Data Plane semantic query modes, formats, domain readiness, scopes, limits, and action-handoff support."
    },
    {
      "id": "external_harness_package",
      "kind": "http_or_tool",
      "path": "/v1/external-harness/package",
      "purpose": "Discover externally safe generated REST/MCP/OpenAI/Anthropic descriptors, playbooks, scopes, execution modes, and receipt contracts."
    },
    {
      "id": "external_harness_manifest",
      "kind": "http_or_tool",
      "path": "/v1/external-harness/manifest",
      "purpose": "Discover generated machine-first route/tool contracts when the productized package is unavailable."
    },
    {
      "id": "agent_tool_schema",
      "kind": "http_or_tool",
      "path": "/v1/agent/tools/schema",
      "purpose": "Discover bounded ViralTrac agent tools and current schema metadata."
    },
    {
      "id": "mcp_tools",
      "kind": "mcp",
      "path": "/mcp",
      "purpose": "Use MCP capability/tool discovery when the host connects ViralTrac through MCP."
    },
    {
      "id": "event_catalog",
      "kind": "http_or_tool",
      "path": "/v1/events/catalog",
      "purpose": "Discover ViralTrac Event / Reactive Plane event meanings/schema versions instead of hardcoding event names."
    },
    {
      "id": "event_coverage",
      "kind": "http_or_tool",
      "path": "/v1/events/coverage",
      "purpose": "Discover current producer/consumer/handoff coverage and cutover/readiness state."
    },
    {
      "id": "event_readiness",
      "kind": "http_or_tool",
      "path": "/v1/events/foundation/readiness",
      "purpose": "Discover current event-plane foundation/runtime readiness."
    },
    {
      "id": "event_consumer_capabilities",
      "kind": "http_or_tool",
      "path": "/v1/events/consumer-capabilities",
      "purpose": "Discover compatible consumer capability profiles and event/reaction semantics."
    },
    {
      "id": "event_managed_recipes",
      "kind": "http_or_tool",
      "path": "/v1/events/managed-recipes",
      "purpose": "Discover managed event/reaction recipes and current eligibility/reconciliation state."
    },
    {
      "id": "event_operations",
      "kind": "http_or_tool",
      "path": "/v1/events/operations",
      "purpose": "Discover current operational mode before enabling live BusinessOS reactive delivery."
    }
  ],
  "capability_mappings": [
    {
      "businessos_capability": "business.data.query",
      "provider_action": "viraltrac:semantic_query",
      "signals_any": [
        "/v1/data/query/execute",
        "data_query_execute",
        "data.query.execute"
      ],
      "auto_bind": true,
      "preferred_use": "Cross-domain first-party business analysis through ViralTrac Semantic Data Plane or equivalent governed semantic query contracts.",
      "limits": [
        "Do not treat supported-but-unavailable tenant data as zero.",
        "Use specialized ViralTrac tools when they are materially better suited than a general semantic query."
      ]
    },
    {
      "businessos_capability": "business.data.explain",
      "provider_action": "viraltrac:semantic_explain",
      "signals_any": [
        "data_query_explain",
        "/explain",
        "data.query.explain"
      ],
      "auto_bind": true,
      "preferred_use": "Inspect plan, definitions, evidence, coverage, freshness, reason codes, and lineage behind a business-data result.",
      "limits": [
        "Narrative explanation cannot upgrade evidence authority or causal status."
      ]
    },
    {
      "businessos_capability": "business.data.export",
      "provider_action": "viraltrac:semantic_export",
      "signals_any": [
        "data_export_create",
        "/v1/data/exports",
        "data.exports"
      ],
      "auto_bind": true,
      "preferred_use": "Create authorized portable analytical exports while ViralTrac retains canonical operational truth.",
      "limits": [
        "Respect transfer/export policy and expiry."
      ]
    },
    {
      "businessos_capability": "business.data.artifact.create",
      "provider_action": "viraltrac:semantic_artifact",
      "signals_any": [
        "data_artifact_create",
        "/v1/data/artifacts",
        "data.artifacts"
      ],
      "auto_bind": true,
      "preferred_use": "Create reproducible derived result/chart/table artifacts with lineage.",
      "limits": [
        "Derived artifacts cannot rewrite canonical truth."
      ]
    },
    {
      "businessos_capability": "business.action.governed.propose",
      "provider_action": "viraltrac:action_propose",
      "signals_any": [
        "/v1/agent/actions/propose",
        "actions.propose"
      ],
      "auto_bind": true,
      "preferred_use": "Hand a BusinessOS action into ViralTrac governed proposal when the target action is supported.",
      "limits": [
        "Proposal is not authorization or proof of execution.",
        "Target-specific capability still matters."
      ]
    },
    {
      "businessos_capability": "business.action.governed.preview",
      "provider_action": "viraltrac:action_preview",
      "signals_any": [
        "/v1/agent/actions/preview",
        "actions.preview"
      ],
      "auto_bind": true,
      "preferred_use": "Preview exclusions, constraints, effects, execution mode, and approval requirements for a supported action.",
      "limits": [
        "Preview cannot substitute for BusinessOS authorization or required user approval."
      ]
    },
    {
      "businessos_capability": "business.action.governed.execute",
      "provider_action": "viraltrac:action_execute",
      "signals_any": [
        "/v1/agent/actions/execute",
        "actions.execute"
      ],
      "auto_bind": true,
      "preferred_use": "Execute a separately authorized action only when ViralTrac advertises the action as executable and policy permits it.",
      "limits": [
        "Never interpret this generic capability as proof every target action is supported.",
        "Respect propose-preview-confirm-execute semantics and idempotency."
      ]
    },
    {
      "businessos_capability": "business.action.receipt.read",
      "provider_action": "viraltrac:action_receipt",
      "signals_any": [
        "/v1/agent/actions/{action_id}/receipt",
        "actions.receipt",
        "receipt packet"
      ],
      "auto_bind": true,
      "preferred_use": "Retrieve authoritative ViralTrac or imported external-execution receipts for BusinessOS ChangeEvent/VerificationRecord linkage.",
      "limits": [
        "A receipt proves the stated execution/effect status, not a causal business outcome."
      ]
    },
    {
      "businessos_capability": "business.measurement.read",
      "provider_action": "viraltrac:measurement_read",
      "signals_any": [
        "/v1/measurement/",
        "measurement panels",
        "measurement action-outcomes",
        "measurement incrementality"
      ],
      "auto_bind": true,
      "preferred_use": "Read governed measurement and outcome evidence after or during an initiative.",
      "limits": [
        "Preserve model/evidence labels and unavailable/partial coverage."
      ]
    },
    {
      "businessos_capability": "business.measurement.evaluate",
      "provider_action": "viraltrac:measurement_evaluate",
      "signals_any": [
        "/v1/measurement/action-outcomes",
        "/v1/measurement/incrementality",
        "/v1/measurement/mta-mmm-compare",
        "measurement-backed proposals"
      ],
      "auto_bind": true,
      "preferred_use": "Support OutcomeEvaluation with governed measurement evidence and causal/evidence ceilings.",
      "limits": [
        "BusinessOS still owns its evaluation conclusion and must preserve confounders/causal uncertainty."
      ]
    },
    {
      "businessos_capability": "business.event.subscribe",
      "provider_action": "viraltrac:event_subscription",
      "signals_any": [
        "/v1/events/transport-subscriptions",
        "/v1/events/consumer-capabilities",
        "event subscription"
      ],
      "auto_bind": false,
      "preferred_use": "Live or reliably surfaced reactive BusinessOS evaluation from ViralTrac Event / Reactive Plane or an equivalent governed event plane after runtime activation checks pass.",
      "limits": [
        "Do not activate from route presence alone; require current operational/readiness evidence and a compatible host delivery mechanism.",
        "An occurrence is not a command and never authorizes an action.",
        "Respect off/publish-shadow/evaluate-shadow/allowlisted-actions/broad/degraded mode semantics.",
        "Polling/scheduling remains the fallback."
      ]
    },
    {
      "businessos_capability": "business.event.catalog.read",
      "provider_action": "viraltrac:event_catalog",
      "signals_any": [
        "/v1/events/catalog",
        "events.catalog",
        "event catalog"
      ],
      "auto_bind": true,
      "preferred_use": "Discover governed event meanings/schema versions for BusinessOS routing.",
      "limits": [
        "Examples/patterns in BusinessOS are hints; current ViralTrac event catalog semantics are authoritative."
      ]
    },
    {
      "businessos_capability": "business.event.coverage.read",
      "provider_action": "viraltrac:event_coverage",
      "signals_any": [
        "/v1/events/coverage",
        "events.coverage",
        "coverage matrix"
      ],
      "auto_bind": true,
      "preferred_use": "Inspect producer/consumer/handoff coverage before depending on a reactive path.",
      "limits": [